{"$id": "https://example.invalid/splay-am-pd/schemas/cycle_anatomy_v0.1.schema.json", "$schema": "https://json-schema.org/draft/2020-12/schema", "description": "SA-02 canonical critical-cycle anatomy record. Exact checks: sum_L==0, p*sum_a==q*sum_y, sum_a==q*k, sum_y==p*k, k>0.", "properties": {"A_access_path": {"items": {"type": "integer"}, "type": "array"}, "A_rotation_signature": {"items": {"type": "string"}, "type": "array"}, "B_access_path": {"type": ["array", "null"]}, "B_rotation_signature": {"type": ["array", "null"]}, "a_i": {"type": "integer"}, "b": {"properties": {"p": {"type": "string"}, "q": {"type": "string"}}, "required": ["p", "q"], "type": "object"}, "cumulative_scaled_slack": {"type": "string"}, "cycle_id": {"type": "string"}, "cycle_length": {"type": "integer", "minimum": 1}, "edge_index": {"type": "integer"}, "key": {"type": "integer"}, "k_multiplier": {"type": "string"}, "L_i": {"type": "string"}, "mode": {"enum": ["DELETE", "KEEP"], "type": "string"}, "n": {"type": "integer"}, "reduced_ratio": {"type": "string"}, "scc_id": {"type": "integer"}, "source_state_id": {"type": "integer"}, "state_sequence": {"type": "array"}, "structural_deltas": {"type": "object"}, "sum_L": {"type": "string", "const": "0"}, "sum_a": {"type": "integer"}, "sum_y": {"type": "integer"}, "target_state_id": {"type": "integer"}, "y_i": {"type": "integer"}}, "required": ["n", "scc_id", "cycle_id", "source_state_id", "target_state_id", "key", "mode", "a_i", "y_i", "L_i", "sum_a", "sum_y", "sum_L", "k_multiplier"], "title": "Cycle anatomy v0.1 (SA-02)", "type": "object"}
