[{"A_access_path": [7, 5, 3, 1], "A_rotation_signature": ["LL", "ZIG"], "B_access_path": [7, 6, 5, 4, 3, 2, 1], "B_rotation_signature": ["LL", "LL", "LL"], "L_i": "-6", "a_i": 4, "b": {"p": "23", "q": "14"}, "cumulative_scaled_slack": "-6", "cycle_id": "n7-scc182544-len10", "cycle_length": 10, "edge_index": 0, "k_multiplier": "2", "key": 1, "mode": "KEEP", "n": 7, "reduced_ratio": "46/28", "scc_id": 182544, "source_state_id": 17160, "state_sequence": [17160, 143185], "structural_deltas": {"A_cases": ["LL", "ZIG"], "B_cases": ["LL", "LL", "LL"]}, "sum_L": "0", "sum_a": 28, "sum_y": 46, "target_state_id": 143185, "y_i": 7}, {"A_access_path": [1, 7], "A_rotation_signature": ["ZIG"], "B_access_path": [1, 6, 7], "B_rotation_signature": ["RR"], "L_i": "4", "a_i": 2, "b": {"p": "23", "q": "14"}, "cumulative_scaled_slack": "-2", "cycle_id": "n7-scc182544-len10", "cycle_length": 10, "edge_index": 1, "k_multiplier": "2", "key": 7, "mode": "KEEP", "n": 7, "reduced_ratio": "46/28", "scc_id": 182544, "source_state_id": 143185, "state_sequence": [143185, 86312], "structural_deltas": {"A_cases": ["ZIG"], "B_cases": ["RR"]}, "sum_L": "0", "sum_a": 28, "sum_y": 46, "target_state_id": 86312, "y_i": 3}, {"A_access_path": [7, 1, 3, 5], "A_rotation_signature": ["RR", "ZIG"], "B_access_path": [7, 6, 1, 4, 5], "B_rotation_signature": ["RR", "LL"], "L_i": "22", "a_i": 4, "b": {"p": "23", "q": "14"}, "cumulative_scaled_slack": "20", "cycle_id": "n7-scc182544-len10", "cycle_length": 10, "edge_index": 2, "k_multiplier": "2", "key": 5, "mode": "KEEP", "n": 7, "reduced_ratio": "46/28", "scc_id": 182544, "source_state_id": 86312, "state_sequence": [86312, 49872], "structural_deltas": {"A_cases": ["RR", "ZIG"], "B_cases": ["RR", "LL"]}, "sum_L": "0", "sum_a": 28, "sum_y": 46, "target_state_id": 49872, "y_i": 5}, {"A_access_path": [5, 3], "A_rotation_signature": ["ZIG"], "B_access_path": [5, 4, 1, 2, 3], "B_rotation_signature": ["RR", "LL"], "L_i": "-24", "a_i": 2, "b": {"p": "23", "q": "14"}, "cumulative_scaled_slack": "-4", "cycle_id": "n7-scc182544-len10", "cycle_length": 10, "edge_index": 3, "k_multiplier": "2", "key": 3, "mode": "KEEP", "n": 7, "reduced_ratio": "46/28", "scc_id": 182544, "source_state_id": 49872, "state_sequence": [49872, 106556], "structural_deltas": {"A_cases": ["ZIG"], "B_cases": ["RR", "LL"]}, "sum_L": "0", "sum_a": 28, "sum_y": 46, "target_state_id": 106556, "y_i": 5}, {"A_access_path": [3, 1], "A_rotation_signature": ["ZIG"], "B_access_path": [3, 2, 1], "B_rotation_signature": ["LL"], "L_i": "4", "a_i": 2, "b": {"p": "23", "q": "14"}, "cumulative_scaled_slack": "0", "cycle_id": "n7-scc182544-len10", "cycle_length": 10, "edge_index": 4, "k_multiplier": "2", "key": 1, "mode": "KEEP", "n": 7, "reduced_ratio": "46/28", "scc_id": 182544, "source_state_id": 106556, "state_sequence": [106556, 163448], "structural_deltas": {"A_cases": ["ZIG"], "B_cases": ["LL"]}, "sum_L": "0", "sum_a": 28, "sum_y": 46, "target_state_id": 163448, "y_i": 3}, {"A_access_path": [1, 3, 5, 7], "A_rotation_signature": ["RR", "ZIG"], "B_access_path": [1, 2, 3, 4, 5, 6, 7], "B_rotation_signature": ["RR", "RR", "RR"], "L_i": "-6", "a_i": 4, "b": {"p": "23", "q": "14"}, "cumulative_scaled_slack": "-6", "cycle_id": "n7-scc182544-len10", "cycle_length": 10, "edge_index": 5, "k_multiplier": "2", "key": 7, "mode": "KEEP", "n": 7, "reduced_ratio": "46/28", "scc_id": 182544, "source_state_id": 163448, "state_sequence": [163448, 76494], "structural_deltas": {"A_cases": ["RR", "ZIG"], "B_cases": ["RR", "RR", "RR"]}, "sum_L": "0", "sum_a": 28, "sum_y": 46, "target_state_id": 76494, "y_i": 7}, {"A_access_path": [7, 1], "A_rotation_signature": ["ZIG"], "B_access_path": [7, 2, 1], "B_rotation_signature": ["LL"], "L_i": "4", "a_i": 2, "b": {"p": "23", "q": "14"}, "cumulative_scaled_slack": "-2", "cycle_id": "n7-scc182544-len10", "cycle_length": 10, "edge_index": 6, "k_multiplier": "2", "key": 1, "mode": "KEEP", "n": 7, "reduced_ratio": "46/28", "scc_id": 182544, "source_state_id": 76494, "state_sequence": [76494, 133386], "structural_deltas": {"A_cases": ["ZIG"], "B_cases": ["LL"]}, "sum_L": "0", "sum_a": 28, "sum_y": 46, "target_state_id": 133386, "y_i": 3}, {"A_access_path": [1, 7, 5, 3], "A_rotation_signature": ["LL", "ZIG"], "B_access_path": [1, 2, 7, 4, 3], "B_rotation_signature": ["LL", "RR"], "L_i": "22", "a_i": 4, "b": {"p": "23", "q": "14"}, "cumulative_scaled_slack": "20", "cycle_id": "n7-scc182544-len10", "cycle_length": 10, "edge_index": 7, "k_multiplier": "2", "key": 3, "mode": "KEEP", "n": 7, "reduced_ratio": "46/28", "scc_id": 182544, "source_state_id": 133386, "state_sequence": [133386, 106552], "structural_deltas": {"A_cases": ["LL", "ZIG"], "B_cases": ["LL", "RR"]}, "sum_L": "0", "sum_a": 28, "sum_y": 46, "target_state_id": 106552, "y_i": 5}, {"A_access_path": [3, 5], "A_rotation_signature": ["ZIG"], "B_access_path": [3, 4, 7, 6, 5], "B_rotation_signature": ["LL", "RR"], "L_i": "-24", "a_i": 2, "b": {"p": "23", "q": "14"}, "cumulative_scaled_slack": "-4", "cycle_id": "n7-scc182544-len10", "cycle_length": 10, "edge_index": 8, "k_multiplier": "2", "key": 5, "mode": "KEEP", "n": 7, "reduced_ratio": "46/28", "scc_id": 182544, "source_state_id": 106552, "state_sequence": [106552, 49790], "structural_deltas": {"A_cases": ["ZIG"], "B_cases": ["LL", "RR"]}, "sum_L": "0", "sum_a": 28, "sum_y": 46, "target_state_id": 49790, "y_i": 5}, {"A_access_path": [5, 7], "A_rotation_signature": ["ZIG"], "B_access_path": [5, 6, 7], "B_rotation_signature": ["RR"], "L_i": "4", "a_i": 2, "b": {"p": "23", "q": "14"}, "cumulative_scaled_slack": "0", "cycle_id": "n7-scc182544-len10", "cycle_length": 10, "edge_index": 9, "k_multiplier": "2", "key": 7, "mode": "KEEP", "n": 7, "reduced_ratio": "46/28", "scc_id": 182544, "source_state_id": 49790, "state_sequence": [49790, 17160], "structural_deltas": {"A_cases": ["ZIG"], "B_cases": ["RR"]}, "sum_L": "0", "sum_a": 28, "sum_y": 46, "target_state_id": 17160, "y_i": 3}]
