[{"A_access_path": [3, 1], "A_rotation_signature": ["ZIG"], "B_access_path": [3, 2, 1], "B_rotation_signature": ["LL"], "L_i": "0", "a_i": 2, "b": {"p": "3", "q": "2"}, "cumulative_scaled_slack": "0", "cycle_id": "n4-scc32-len2", "cycle_length": 2, "edge_index": 0, "k_multiplier": "2", "key": 1, "mode": "KEEP", "n": 4, "reduced_ratio": "6/4", "scc_id": 32, "source_state_id": 87, "state_sequence": [87, 167], "structural_deltas": {"A_cases": ["ZIG"], "B_cases": ["LL"]}, "sum_L": "0", "sum_a": 4, "sum_y": 6, "target_state_id": 167, "y_i": 3}, {"A_access_path": [1, 3], "A_rotation_signature": ["ZIG"], "B_access_path": [1, 2, 3], "B_rotation_signature": ["RR"], "L_i": "0", "a_i": 2, "b": {"p": "3", "q": "2"}, "cumulative_scaled_slack": "0", "cycle_id": "n4-scc32-len2", "cycle_length": 2, "edge_index": 1, "k_multiplier": "2", "key": 3, "mode": "KEEP", "n": 4, "reduced_ratio": "6/4", "scc_id": 32, "source_state_id": 167, "state_sequence": [167, 87], "structural_deltas": {"A_cases": ["ZIG"], "B_cases": ["RR"]}, "sum_L": "0", "sum_a": 4, "sum_y": 6, "target_state_id": 87, "y_i": 3}, {"A_access_path": [4, 1], "A_rotation_signature": ["ZIG"], "B_access_path": [4, 3, 1], "B_rotation_signature": ["LL"], "L_i": "0", "a_i": 2, "b": {"p": "3", "q": "2"}, "cumulative_scaled_slack": "0", "cycle_id": "n4-scc53-len2", "cycle_length": 2, "edge_index": 0, "k_multiplier": "2", "key": 1, "mode": "KEEP", "n": 4, "reduced_ratio": "6/4", "scc_id": 53, "source_state_id": 57, "state_sequence": [57, 137], "structural_deltas": {"A_cases": ["ZIG"], "B_cases": ["LL"]}, "sum_L": "0", "sum_a": 4, "sum_y": 6, "target_state_id": 137, "y_i": 3}, {"A_access_path": [1, 4], "A_rotation_signature": ["ZIG"], "B_access_path": [1, 3, 4], "B_rotation_signature": ["RR"], "L_i": "0", "a_i": 2, "b": {"p": "3", "q": "2"}, "cumulative_scaled_slack": "0", "cycle_id": "n4-scc53-len2", "cycle_length": 2, "edge_index": 1, "k_multiplier": "2", "key": 4, "mode": "KEEP", "n": 4, "reduced_ratio": "6/4", "scc_id": 53, "source_state_id": 137, "state_sequence": [137, 57], "structural_deltas": {"A_cases": ["ZIG"], "B_cases": ["RR"]}, "sum_L": "0", "sum_a": 4, "sum_y": 6, "target_state_id": 57, "y_i": 3}, {"A_access_path": [4, 2], "A_rotation_signature": ["ZIG"], "B_access_path": [4, 3, 2], "B_rotation_signature": ["LL"], "L_i": "0", "a_i": 2, "b": {"p": "3", "q": "2"}, "cumulative_scaled_slack": "0", "cycle_id": "n4-scc87-len2", "cycle_length": 2, "edge_index": 0, "k_multiplier": "2", "key": 2, "mode": "KEEP", "n": 4, "reduced_ratio": "6/4", "scc_id": 87, "source_state_id": 28, "state_sequence": [28, 106], "structural_deltas": {"A_cases": ["ZIG"], "B_cases": ["LL"]}, "sum_L": "0", "sum_a": 4, "sum_y": 6, "target_state_id": 106, "y_i": 3}, {"A_access_path": [2, 4], "A_rotation_signature": ["ZIG"], "B_access_path": [2, 3, 4], "B_rotation_signature": ["RR"], "L_i": "0", "a_i": 2, "b": {"p": "3", "q": "2"}, "cumulative_scaled_slack": "0", "cycle_id": "n4-scc87-len2", "cycle_length": 2, "edge_index": 1, "k_multiplier": "2", "key": 4, "mode": "KEEP", "n": 4, "reduced_ratio": "6/4", "scc_id": 87, "source_state_id": 106, "state_sequence": [106, 28], "structural_deltas": {"A_cases": ["ZIG"], "B_cases": ["RR"]}, "sum_L": "0", "sum_a": 4, "sum_y": 6, "target_state_id": 28, "y_i": 3}, {"A_access_path": [4, 1], "A_rotation_signature": ["ZIG"], "B_access_path": [4, 2, 1], "B_rotation_signature": ["LL"], "L_i": "0", "a_i": 2, "b": {"p": "3", "q": "2"}, "cumulative_scaled_slack": "0", "cycle_id": "n4-scc163-len2", "cycle_length": 2, "edge_index": 0, "k_multiplier": "2", "key": 1, "mode": "KEEP", "n": 4, "reduced_ratio": "6/4", "scc_id": 163, "source_state_id": 72, "state_sequence": [72, 152], "structural_deltas": {"A_cases": ["ZIG"], "B_cases": ["LL"]}, "sum_L": "0", "sum_a": 4, "sum_y": 6, "target_state_id": 152, "y_i": 3}, {"A_access_path": [1, 4], "A_rotation_signature": ["ZIG"], "B_access_path": [1, 2, 4], "B_rotation_signature": ["RR"], "L_i": "0", "a_i": 2, "b": {"p": "3", "q": "2"}, "cumulative_scaled_slack": "0", "cycle_id": "n4-scc163-len2", "cycle_length": 2, "edge_index": 1, "k_multiplier": "2", "key": 4, "mode": "KEEP", "n": 4, "reduced_ratio": "6/4", "scc_id": 163, "source_state_id": 152, "state_sequence": [152, 72], "structural_deltas": {"A_cases": ["ZIG"], "B_cases": ["RR"]}, "sum_L": "0", "sum_a": 4, "sum_y": 6, "target_state_id": 72, "y_i": 3}, {"A_access_path": [4, 1], "A_rotation_signature": ["ZIG"], "B_access_path": [4, 3, 1], "B_rotation_signature": ["LL"], "L_i": "0", "a_i": 2, "b": {"p": "3", "q": "2"}, "cumulative_scaled_slack": "0", "cycle_id": "n4-scc168-len2", "cycle_length": 2, "edge_index": 0, "k_multiplier": "2", "key": 1, "mode": "KEEP", "n": 4, "reduced_ratio": "6/4", "scc_id": 168, "source_state_id": 71, "state_sequence": [71, 151], "structural_deltas": {"A_cases": ["ZIG"], "B_cases": ["LL"]}, "sum_L": "0", "sum_a": 4, "sum_y": 6, "target_state_id": 151, "y_i": 3}, {"A_access_path": [1, 4], "A_rotation_signature": ["ZIG"], "B_access_path": [1, 3, 4], "B_rotation_signature": ["RR"], "L_i": "0", "a_i": 2, "b": {"p": "3", "q": "2"}, "cumulative_scaled_slack": "0", "cycle_id": "n4-scc168-len2", "cycle_length": 2, "edge_index": 1, "k_multiplier": "2", "key": 4, "mode": "KEEP", "n": 4, "reduced_ratio": "6/4", "scc_id": 168, "source_state_id": 151, "state_sequence": [151, 71], "structural_deltas": {"A_cases": ["ZIG"], "B_cases": ["RR"]}, "sum_L": "0", "sum_a": 4, "sum_y": 6, "target_state_id": 71, "y_i": 3}, {"A_access_path": [4, 1], "A_rotation_signature": ["ZIG"], "B_access_path": [4, 2, 1], "B_rotation_signature": ["LL"], "L_i": "0", "a_i": 2, "b": {"p": "3", "q": "2"}, "cumulative_scaled_slack": "0", "cycle_id": "n4-scc185-len2", "cycle_length": 2, "edge_index": 0, "k_multiplier": "2", "key": 1, "mode": "KEEP", "n": 4, "reduced_ratio": "6/4", "scc_id": 185, "source_state_id": 58, "state_sequence": [58, 138], "structural_deltas": {"A_cases": ["ZIG"], "B_cases": ["LL"]}, "sum_L": "0", "sum_a": 4, "sum_y": 6, "target_state_id": 138, "y_i": 3}, {"A_access_path": [1, 4], "A_rotation_signature": ["ZIG"], "B_access_path": [1, 2, 4], "B_rotation_signature": ["RR"], "L_i": "0", "a_i": 2, "b": {"p": "3", "q": "2"}, "cumulative_scaled_slack": "0", "cycle_id": "n4-scc185-len2", "cycle_length": 2, "edge_index": 1, "k_multiplier": "2", "key": 4, "mode": "KEEP", "n": 4, "reduced_ratio": "6/4", "scc_id": 185, "source_state_id": 138, "state_sequence": [138, 58], "structural_deltas": {"A_cases": ["ZIG"], "B_cases": ["RR"]}, "sum_L": "0", "sum_a": 4, "sum_y": 6, "target_state_id": 58, "y_i": 3}]
